<?xml version="1.0" encoding="UTF-8"?>
<libros xmlns:xsi="http://www.w3.org/2001/XMLSchema-instance" xsi:noNamespaceSchemaLocation="/home/local/DANIELCASTELAO/fsancheztemprano/Documentos/LMSXI/b25/6.xsd">
  <libro>
    <titulo>Los hombres que no amaban a las mujeres</titulo>
    <autor>Stieg Larsson</autor>
    <autor/>
    <fecha>2008</fecha>
    <isbn>978-84-233</isbn>
    <editor>Destino</editor>
    <categ>ficcion</categ>
    <stock>Si</stock>
  </libro>
  <libro revisor="Luis Rodrigo">
    <titulo>Java a través de los tiempos</titulo>
    <autor>Jesús Bobadilla</autor>
    <autor>Adela Sancho</autor>
    <fecha>2003</fecha>
    <isbn>978-84-567</isbn>
    <editor>Ra-Ma</editor>
    <categ>no ficcion</categ>
    <stock>No</stock>
  </libro>
</libros>
